{
  "kind": "epics",
  "group": "epics",
  "description": "New epics E24 to E32. Epics live in PenniLogic/docs and carry no Estimate; their Rollup is the sum of child ticket estimates.",
  "items": [
    {
      "stable_id": "E24",
      "title": "[EPIC] E24 - Platform, deployment and reliability",
      "phase": "P0 Foundations",
      "sprint": "Sprint 04",
      "component": "infra",
      "priority": "P0 Critical",
      "perspective": "Ops",
      "risk": "None",
      "status": "Backlog",
      "labels": [
        "epic",
        "chore",
        "P0-critical"
      ],
      "goal": "Own the infrastructure, deployment, backup, disaster-recovery and observability work that E01 explicitly deferred and E19 never picked up, so that no service reaches real user data without a runnable environment, a proven restore and an alert that reaches a human.",
      "scope": [
        "Infrastructure as code for every environment; no click-ops",
        "Deploy pipelines with canary, feature flags, kill switches and reversible migrations",
        "Backups, point-in-time recovery, a secondary region and a performed restore drill",
        "OpenTelemetry traces, metrics and logs, SLOs, alert routing and on-call rotation",
        "NTP synchronisation and India-region tamper-evident log retention for CERT-In",
        "Structured log scrubbing so financial values and PII never reach a log sink"
      ],
      "out_of_scope": [
        "Application-layer cryptography and tenancy isolation (E19)",
        "Kubernetes; the chosen runtime is ECS Fargate per the stack decision",
        "Vendor certification programmes such as SOC 2 or ISO 27001"
      ],
      "exit_criteria": [
        "Every environment is created from code and can be destroyed and recreated",
        "A restore from backup into a clean account has actually been performed and timed against a written RPO and RTO",
        "Golden-signal dashboards exist and at least one alert has been proven to page the on-call owner",
        "A deliberately planted financial value in a log line fails the CI log-scan gate",
        "A rollback has been rehearsed for each deployable component and the evidence is attached to the release record"
      ],
      "dependencies": [
        "docs#1",
        "E31"
      ],
      "traceability": [
        "docs/architecture/03-stack-and-monetization.md section 15",
        "docs/compliance/01-regulatory-landscape.md CERT-In requirements",
        "planning-audit-input.md: deployment, IaC, backups, restore, DR, observability, SLOs, alerting and on-call have no owner"
      ]
    },
    {
      "stable_id": "E25",
      "title": "[EPIC] E25 - Quality, verification and release assurance",
      "phase": "P0 Foundations",
      "sprint": "Sprint 03",
      "component": "cross-cutting",
      "priority": "P0 Critical",
      "perspective": "QA",
      "risk": "None",
      "status": "Backlog",
      "labels": [
        "epic",
        "chore",
        "P0-critical"
      ],
      "goal": "Turn the written test strategy into executable, enforced gates covering the whole verification surface: unit, property, integration, contract and end-to-end; black-box and white-box security testing; SAST and DAST; mutation testing; load, stress and soak; chaos; backup, restore and disaster recovery; accessibility; performance budgets; privacy traffic inspection; penetration testing; and release and rollback evidence. This epic is cross-cutting: its tickets span Sprint 02 to post-beta, and the platform work it consumes is expressed as ticket-level dependencies rather than an epic-level block.",
      "scope": [
        "Money-path verification harness: property-based, mutation and independent-model gates plus idempotency and adversarial retry",
        "Provider and consumer contract testing against the published OpenAPI spec",
        "Active cross-tenant, BOLA and authentication attack suites (white-box and black-box)",
        "SAST, DAST, dependency and secret scanning as blocking CI gates, with flaky-test quarantine",
        "Load, stress, soak and chaos suites plus a disaster-recovery game day",
        "Accessibility conformance and performance budgets as CI gates on Android and web",
        "Automated privacy traffic inspection on every release candidate",
        "Threat-model refresh loop, independent penetration test and black-box red-team scenarios"
      ],
      "out_of_scope": [
        "Writing the feature tests that belong to each feature ticket; this epic owns harnesses, gates and evidence",
        "Certification audits"
      ],
      "exit_criteria": [
        "Every verification category named in the goal has an owning ticket, a runner and a gate that can fail a pull request or a release",
        "Money-path modules fail CI when the mutation threshold or the independent-model comparison is not met",
        "A release candidate cannot be promoted without accessibility, performance, privacy-capture and rollback evidence",
        "The penetration test has been completed and all high and critical findings are closed and retested",
        "Epic scheduling is nominal: ticket-level dependencies govern order, and no quality ticket is blocked by the epic sprint value"
      ],
      "dependencies": [
        "docs#21"
      ],
      "traceability": [
        "docs#21 test strategy",
        "docs#22 release checklist",
        "planning-audit-input.md: load, stress, soak, chaos, restore drills, accessibility, performance budgets, mutation testing, automated privacy inspection, billing replay, AI eval CI, pen test and rollback rehearsals lack executable tickets"
      ]
    },
    {
      "stable_id": "E26",
      "title": "[EPIC] E26 - Architecture decision gates",
      "phase": "P0 Foundations",
      "sprint": "Sprint 02",
      "component": "docs",
      "priority": "P0 Critical",
      "perspective": "Architecture",
      "risk": "None",
      "status": "Backlog",
      "labels": [
        "epic",
        "needs-adr",
        "P0-critical"
      ],
      "goal": "Close the nine architecture decisions that currently force implementers to guess, so that no data-touching ticket is written against an undecided model. Each decision is a dated ADR with a chosen option, rejected options and the migration consequence, published as its own reserved file so the nine can be written in parallel.",
      "scope": [
        "Money wire format, time and idempotency conventions",
        "Category model as an append-only reporting dimension",
        "Ledger, foreign exchange and debt-balance derivation",
        "Encryption scope, searchable fields and row-level security",
        "Authentication, passkeys, provider, relying-party identifier, recovery and device binding",
        "Admin boundary: separate process, host, database role, policy boundary and audit stream",
        "Shared-data erasure and cross-user key access",
        "AI egress, runtime platform and Mode C custom endpoints",
        "Entitlement and quota model: plan and feature identity, request and token dimensions, model allowlist, BYOK treatment, usage accounting and reset boundary",
        "Per-decision file layout, reserved numbering ADR-015 to ADR-023, and a generated index so nine records never edit the same lines"
      ],
      "out_of_scope": [
        "Implementation of any decision; each ADR is followed by its own implementation tickets",
        "Decisions with no current implementation consumer"
      ],
      "exit_criteria": [
        "All nine ADRs are merged as ADR-015 to ADR-023, each in its own file, dated and linked from the epics and tickets they unblock, with the index and pending table generated rather than hand-edited",
        "Every ADR names the option chosen, the options rejected and the migration cost of reversing it",
        "No ticket in Ready depends on an open ADR",
        "Each ADR lists the tests that will prove the decision was implemented as written",
        "The two conflicting entitlement sketches in the research documents are marked superseded in place by the accepted entitlement record"
      ],
      "dependencies": [
        "T-GOV-03"
      ],
      "traceability": [
        "planning-audit-input.md architecture direction items 1 to 12",
        "docs/architecture/02-security-architecture.md",
        "docs/ai/01-ai-harness-research.md",
        "architecture/01-domain-model.md section 5 and architecture/03-stack-and-monetization.md section 8 describe entitlements differently; ADR-023 supersedes one of them"
      ]
    },
    {
      "stable_id": "E27",
      "title": "[EPIC] E27 - Launch-blocking compliance floor",
      "phase": "P0 Foundations",
      "sprint": "Sprint 09",
      "component": "cross-cutting",
      "priority": "P0 Critical",
      "perspective": "Compliance",
      "risk": "R15 Data lifecycle",
      "status": "Backlog",
      "labels": [
        "epic",
        "compliance",
        "P0-critical"
      ],
      "goal": "Land the compliance obligations that legally must exist before the first real person is onboarded, including the closed beta. E20 keeps the post-beta readiness work; this epic carries only what a beta user makes mandatory.",
      "scope": [
        "Consent ledger, purpose registry and data-principal rights with a defined service level",
        "Pre-onboarding consent, age gate and permission dashboard on Android",
        "Third-party SDK inventory, payload scrubbing and an accurate Play Data Safety declaration",
        "Privacy policy, terms, disclaimers and processor agreements published before onboarding",
        "CERT-In point of contact, six-hour breach reporting runbook and a rehearsed drill",
        "Retention schedule expressed as enforced jobs rather than a document"
      ],
      "out_of_scope": [
        "Counsel review of expansion markets and Account Aggregator positioning (E20, E29)",
        "Backend cryptography (E19) and platform log retention (E24)",